topic_id,search_term,title,summary,keywords,published_date,link,source,sentiment,polarity,scraped_at
1,private credit,Does private credit have a ratings problem? - Financial Times,"Try unlimited access Only $1 for 4 weeks Then $75 per month.
Complete digital access to quality FT journalism on any device.
Check whether you already have access via your university or organisation.
Terms & Conditions apply For individuals Discover all the plans currently available in your country For multiple readers Digital access for organisations.
Includes exclusive features and content.","private, credit, ratings, problem, access, digital, unlimited, weeks, 75, month, complete, quality, ft, journalism, device, cancel, anytime, trial, check, university, organisation, terms, conditions, apply, individuals, discover, plans, country, multiple, readers, organisations, includes, exclusive, features, content",2025-11-12,https://www.ft.com/content/045232ac-e5a3-43e8-9291-368b44581e79,financial times,positive,0.0964,2025-11-12 09:30:43
1,private credit,New Ratings Reveal Challenges for Semiliquid Funds - Morningstar,"Semiliquid Funds’ Challenges The semiliquid fund universe remains relatively young and untested.
Many private credit funds in this class of ratings weren’t around when credit spreads last blew out in early 2020, and none of them predated June 2018.
Fees hinder these semiliquid funds.
What’s Next for Morningstar’s Semiliquid Fund Medalist Ratings Expect more semiliquid fund ratings in 2026, including tender-offer funds, nontraded business development companies, and nontraded REITs.
Setting Semiliquid Funds’ Bogy Benchmarking semiliquid funds is a challenge.","reveal, challenges, funds, semiliquid, ratings, private, credit, morningstar, fund, cliffwater, including, asset, direct, investment, blackstone, carlyle, fund’s, average, equity, rating, strategy, class, investors, fees, management, bow, capital, lending, medalist, conviction, returns, multi-asset, global, 2025, making",2025-11-12,https://www.morningstar.com/funds/new-ratings-reveal-challenges-semiliquid-funds,morningstar,negative,-0.5761,2025-11-13 09:36:20
3, stock tokenization,Pantera-Backed Solana Company to Tokenize Its Shares With Superstate's Opening Bell - Yahoo Finance,"In this article: Solana Company (HSDT), a Nasdaq-listed digital asset treasury company focused on Solana (SOL), said on Wednesday it plans to tokenize its shares with Superstate’s Opening Bell, a regulated platform that brings traditional equities onchain.
""We believe the majority of [onchain market] activity will take place on Solana,"" said Cosmo Jiang, general partner at Pantera and a board member at Solana Company.
Superstate’s Opening Bell, introduced earlier this year, runs on the Solana blockchain and aims to bridge public capital markets with blockchain infrastructure.
This development adds to a small but growing list of digital asset treasuries experimenting with equity tokenization.
In September, fellow Forward Industries (FORD) unveiled plans to tokenize its common stock with Superstate on Solana.","pantera-backed, superstate's, solana, company, shares, tokenize, opening, bell, tokenization, digital, asset, treasury, plans, superstate’s, onchain, tokenized, pantera, capital, blockchain, article, hsdt, nasdaq-listed, focused, sol, regulated, platform, brings, traditional, equities, remain, sec-registered, maintain, existing, protections, accessible",2025-11-12,https://finance.yahoo.com/news/pantera-backed-solana-company-tokenize-161841463.html,yahoo finance,positive,0.8233,2025-11-13 09:39:54
3, stock tokenization,Robinhood CEO Says Tokenization Will 'Unlock 24/7 Markets' And Investors Will 'Never Go Back' - Yahoo Finance,"Vlad Tenev, the CEO and co-founder of Robinhood Markets Inc. (NASDAQ:HOOD), declared that the era of traditional 9-to-5 trading is numbered, predicting that asset tokenization will inevitably lead to 24/7 global markets.
Arrived Backed by Jeff Bezos, Arrived Homes makes real estate investing accessible with a low barrier to entry.
This allows everyday investors to diversify into real estate, collect rental income, and build long-term wealth without needing to manage properties directly.
Investors earn a fixed 7% annual return, with funds deployed to small U.S. businesses.
This article Robinhood CEO Says Tokenization Will 'Unlock 24/7 Markets' And Investors Will 'Never Go Back' originally appeared on Benzinga.com","ceo, unlock, investors, markets, 24, tokenization, robinhood, trading, real, earn, stock, estate, wealth, bonds, tenev, hood, asset, assets, users, retirement, cash, ira, global, market, stocks, invest, technology, access, company, blockchain, crypto, tokenized, building, diversify, self-directed",2025-11-12,https://finance.yahoo.com/news/robinhood-ceo-says-tokenization-unlock-223130354.html,yahoo finance,negative,-0.2248,2025-11-14 09:38:45
1,private credit,"Private Credit Will Keep Growing, Apollo's Grewal Says - Yahoo Finance","In this video: Akila Grewal, Apollo Global Management partner and global head of product, says private credit is an enduring asset category and will continue to grow.
Speaking with Dani Burger and Matt Miller on ""Bloomberg Open Interest,"" Grewal says she is focusing on long-duration assets and also discusses the firm's approach to sports investing.
Recommended Stories","growing, apollo's, grewal, private, credit, global, video, akila, apollo, management, partner, head, product, enduring, asset, category, continue, grow, speaking, dani, burger, matt, miller, bloomberg, open, interest, focusing, long-duration, assets, discusses, firm's, approach, investing, recommended",2025-11-12,https://finance.yahoo.com/video/private-credit-keep-growing-apollos-161300610.html,yahoo finance,positive,0.6463,2025-11-15 09:26:47
