topic_id,search_term,title,summary,keywords,published_date,link,source,sentiment,polarity,scraped_at
1,private credit,Credit Fuels the AI Boom — and Fears of a Bubble - Yahoo Finance,"Credit investors are pouring billions of dollars into artificial intelligence investments, just as industry executives and analysts are raising questions about whether the new technology is inflating another bubble.
OpenAI alone estimates it will need trillions of dollars over time to spend on the infrastructure required to develop and run artificial intelligence services.
At the same time, key players in the industry acknowledge there is probably pain ahead for AI investors.
OpenAI Chief Executive Officer Sam Altman said this week that he sees parallels between the current investment frenzy in artificial intelligence and the dot-com bubble in the late 1990s.
Recently, though, the money has been increasingly coming from bond investors and private credit lenders.","fuels, boom, fears, ai, credit, bubble, investors, intelligence, artificial, bloomberg, investment, infrastructure, companies, dollars, industry, questions, technology, housing, billion, data, massive, week, meta, platforms, coming, openai, corporate, it’s, early, s, tech, debt, pouring, billions, investments",2025-08-23,https://finance.yahoo.com/news/credit-fuels-ai-boom-fears-153316716.html,yahoo finance,positive,0.8111,2025-08-24 09:25:03
