topic_id,search_term,title,summary,keywords,published_date,link,source,sentiment,polarity,scraped_at
1,private credit,"NEUBERGER LAUNCHES FIRST INTERVAL FUND, PROVIDING PRIVATE CREDIT SOLUTIONS TO INVESTORS - PR Newswire","NEW YORK, Aug. 20, 2025 /PRNewswire/ -- Neuberger Berman, a global, private, employee-owned investment manager, is pleased to announce the launch of NB Asset-Based Credit Fund (Ticker: NABFX) (the ""Fund""), the firm's first interval fund, which offers a private credit solution for individual investors.
About Neuberger Neuberger Berman is an employee-owned, private, independent investment manager founded in 1939 with over 2,800 employees in 26 countries.
In addition, degree of subordination, lack or inadequacy of collateral or credit enhancement for a debt instrument may affect its credit risk.
Additionally, there may be a limited market for the sale of consumer loans, or the collateral of defaulted consumer loans.
The ""Neuberger Berman"" name and logo are registered service marks of Neuberger Berman Group LLC.","launches, interval, providing, solutions, fund, credit, neuberger, investors, private, investment, loans, investments, berman, risk, consumer, interest, market, nb, asset-based, securities, fund's, finance, group, income, including, limited, management, debt, individual, specialty, company, investor, firm, subject, collateral",2025-08-20,https://www.prnewswire.com/news-releases/neuberger-launches-first-interval-fund-providing-private-credit-solutions-to-investors-302534158.html,pr newswire,negative,-0.3098,2025-08-23 09:23:59
3, stock tokenization,Shineco Shares Surge On Launch Of Blockchain-Based Cell Asset Tokenization Platform - Benzinga,"Shineco Inc. SISI shares are trading higher on Wednesday after the company announced the launch of what it calls the world's first on-chain cell asset tokenization platform.
See what is happening to SISI stock here.
What To Know: To support the system, Shineco acquired a 51% stake in Xi'an Dong'ao Health Management, a company specializing in cryogenic cell storage and clinical applications.
This deal, along with its earlier purchase of Singapore-based Infiniclone, gives Shineco the physical infrastructure needed to connect blockchain-based tokens with real-world cell storage and treatment.
SISI Price Action: Shineco shares were up 36.97% at $6.78 at market close on Wednesday, according to Benzinga Pro.","shineco, surge, blockchain-based, nasdaq, cell, sisi, shares, launch, platform, asset, tokenization, company, stock, storage, biotech, market, trading, higher, announced, calls, world's, on-chain, happening, support, system, acquired, 51, stake, xi'an, dong'ao, health, management, specializing, cryogenic, clinical",2025-08-20,https://www.benzinga.com/trading-ideas/movers/25/08/47246440/shineco-shares-surge-on-launch-of-blockchain-based-cell-asset-tokenization-platform,benzinga,positive,0.8271,2025-08-23 09:35:00
