topic_id,search_term,title,summary,keywords,published_date,link,source,sentiment,polarity,scraped_at
1,private credit,"Jamie Dimon issues private credit warning: ‘When you see one cockroach, there are probably more’ - Fortune","But JPMorgan CEO Jamie Dimon also warned that if or when an economic downturn comes, investors should expect more companies that have taken on too much debt go the way of First Brands.
“And I probably shouldn’t say this, but when you see one cockroach, there are probably more.
CFO Jeremy Barnum said: “A lot of the private credit actors are large, very sophisticated, very good at credit underwriting.
And we don’t even know the standards [of] other banks’ underwriting to some of these entities.
“But I think we feel very, very good about our processes, our collateral, the structure of the book.”","issues, private, warning, cockroach, credit, dimon, jamie, good, standards, lending, expect, underwriting, don’t, risk, ceo, downturn, debt, brands, things, wall, street, exposure, jeremy, barnum, smart, they’re, banks, diversified, book, vast, majority, investment-grade, rated, we’re, constantly",2025-10-15,https://fortune.com/2025/10/15/jamie-dimon-issues-private-credit-warning-when-you-see-one-cockroach-there-are-probably-more/,fortune,positive,0.6267,2025-10-16 09:28:45
1,private credit,"The secretive First Brands founder, his $12bn debt and the future of private credit - Financial Times","Then S$99 per month.
Complete digital access to quality FT journalism on any device.
Cancel or change your plan anytime during your trial.
Complete digital access to quality FT journalism with expert analysis from industry leaders.
Pay a year upfront and save 20%.","secretive, brands, founder, 12bn, debt, future, private, credit, complete, digital, access, quality, ft, journalism, s, 99, month, device, cancel, change, plan, anytime, trial, expert, analysis, industry, leaders, pay, upfront, save, 20",2025-10-15,https://www.ft.com/content/83734e55-f3a6-46b6-865e-f16667d2fd3b,financial times,positive,0.1053,2025-10-16 09:29:36
1,private credit,Top US financiers sound alarm on lending standards - Financial Times,"A required part of this site couldn’t load.
This may be due to a browser extension, network issues, or browser settings.
Please check your connection, disable any ad blockers, or try using a different browser.","client, challenge, browser, required, site, couldn’t, load, extension, network, issues, settings, check, connection, disable, ad, blockers",2025-10-15,https://www.ft.com/content/f1b61807-c199-4fee-9bd4-dea738e1a0ac,financial times,neutral,0.031,2025-10-16 09:32:01
1,private credit,Hamilton Lane Tokenized Private Credit Fund Launches on Sei Network via KAIO's Institutional-grade Infrastructure - PR Newswire,"Hamilton Lane has worked to make access to its SCOPE fund (via ""HL SCOPE Access Fund"") available on KAIO.
The HL SCOPE Access Fund provides access to SCOPE, an all-weather senior private credit evergreen vehicle, which seeks to generate consistency of performance and cash yield across cycles.
About KAIO: KAIO is the leading protocol purpose-built for RWAs, ensuring seamless movement, compliance, and liquidity in DeFi.
1 Access is through Hamilton Lane SCOPE Private Credit Access fund (""HL SCOPE Access Fund""), a feeder fund setup to invest into SCOPE.
The HL SCOPE Access Fund is not managed or operated by Hamilton Lane.","tokenized, launches, kaio's, institutional-grade, infrastructure, fund, hamilton, sei, lane, private, network, credit, access, kaio, scope, investment, ability, investors, assets, markets, forward-looking, statements, risks, institutional, securities, manage, leading, strategies, onchain, hl, digital, information, https, clients, funds",2025-10-15,https://www.prnewswire.com/news-releases/hamilton-lane-tokenized-private-credit-fund-launches-on-sei-network-via-kaios-institutional-grade-infrastructure-302584247.html,pr newswire,positive,0.9244,2025-10-16 09:33:31
1,private credit,Why Public/Private Market Funds’ Yields Are a Double-Edged Sword - Morningstar,"That’s true for all funds, but especially for semiliquid funds.
Vehicles like interval funds, tender-offer funds, nontraded business development companies, and nontraded real estate investment trusts straddle private and public markets.
By borrowing money to buy more assets, funds can amplify gains and offer bigger distributions—especially in private credit, where double-digit yields have drawn crowds.
These vehicles, predominantly private credit funds, can borrow up to $2 for every $1 of investor capital, fueling eye-catching yields.
Beware the Fragility Leverage can make semiliquid funds look impressive until market stress exposes their cracks.","public, double-edged, sword, funds, private, yields, market, assets, leverage, semiliquid, investors, interval, nontraded, credit, capital, risks, debt, returns, selling, fund, vehicles, venture, potential, equity, redemptions, base, losses, portfolio, managers, miss, performance, tender-offer, business, development, companies",2025-10-15,https://www.morningstar.com/funds/why-publicprivate-market-funds-yields-are-double-edged-sword,morningstar,positive,0.9246,2025-10-16 09:33:59
1,private credit,3 Reasons to Care About Private Markets Even if You’re Not Investing in Them - Morningstar,"Growth in private equity, venture capital, private debt, and other such funds has been truly astounding.
With abundant funding from private capital, companies can avoid the scrutiny, reporting, and regulation that come with publicly listing.
Private Capital Will Be Reshaping Investing for Years to Come In the PitchBook private capital data above, did you notice “dry powder” in the neighborhood of $4 trillion?
Private equity, venture capital, and private debt will continue to compete with public stock and bond markets for capital formation.
No matter your view on their relative merits, the impact of private markets’ growth can’t be ignored.","reasons, care, you’re, investing, private, markets, public, market, companies, capital, equity, growth, morningstar, small, small-cap, investors, stocks, debt, funds, bonds, caps, pitchbook, asset, recently, high-yield, loans, retail, it’s, trillion, venture, index, broad, class, investment, access",2025-10-15,https://www.morningstar.com/stocks/3-reasons-care-about-private-markets-even-if-youre-not-investing-them,morningstar,positive,0.6059,2025-10-16 09:34:12
2,securities tokenization,SoloTex Set to Bring Tokenized Stocks to U.S. Retail Traders With FINRA Green Light - Yahoo Finance,"Stock tokenization spreads Tokenization of traditional assets has drawn growing interest from major financial firms and startups alike.
Tokenized stocks gained steam earlier this year as a roster of trading platforms and crypto exchanges rolled out tokenized equities including Gemini, Kraken, Bybit and Robinhood.
Meanwhile, synthetic stock tokens or exposure through special purpose vehicles (SPVs) that often don’t provide actual share ownership.
""Offering actual tokenized U.S. equities to the U.S. market has always been the holy grail,"" said Ashley Ebersole, legal advisor for SoloTex, in a statement.
Read more: Tokenized Stocks Aren’t Working (Yet) Recommended Stories","set, bring, traders, finra, green, light, s, tokenized, solotex, stocks, retail, market, tokens, regulatory, tokenization, real, stock, platform, capital, equities, mccluskey, share, ownership, actual, trade, offshore, aims, texture, trading, investors, usdc, sologenic, ceo, johnson, offering",2025-10-15,https://finance.yahoo.com/news/solotex-set-bring-tokenized-stocks-133115389.html,yahoo finance,positive,0.7792,2025-10-16 09:35:47
1,private credit,Dimon’s ‘Cockroach’ Fear Revives Threat of Cracks in Credit - Yahoo Finance,"“I suspect when there’s a downturn you will see higher-than-normal downturn type of credit losses in certain categories,” he said.
While results sent shares of Citigroup and Wells Fargo higher, the downbeat notes and rising compensation costs trimmed prices at JPMorgan and Goldman.
Investors have been fleeing BDCs, seen as a proxy for the $1.7 trillion private-credit market, as they cut distributions available to shareholders.
Last month, the $75 billion non-traded Blackstone Private Credit Fund, the largest in the industry, said it was reducing its shareholder payouts.
Chief Financial Officer Jeremy Barnum and his Wells Fargo counterpart, Michael Santomassimo, reassured analysts that much of their exposures are to large, established private-credit players.","dimon’s, cockroach, fear, revives, threat, cracks, credit, investors, market, dimon, jpmorgan, analysts, wells, fargo, private-credit, group, bank, housing, turn, gap, chief, officer, markets, companies, record, posting, results, downturn, bdcs, private, citigroup, goldman, lending, signs, growing",2025-10-15,https://finance.yahoo.com/news/dimon-cockroach-fear-revives-threat-002028968.html,yahoo finance,positive,0.8568,2025-10-17 09:28:27
1,private credit,Hamilton Lane Tokenized Private Credit Fund Launches on Sei Network via KAIO's Institutional-grade Infrastructure - Morningstar,"Hamilton Lane has worked to make access to its SCOPE fund (via ""HL SCOPE Access Fund"") available on KAIO.
The HL SCOPE Access Fund provides access to SCOPE, an all-weather senior private credit evergreen vehicle, which seeks to generate consistency of performance and cash yield across cycles.
About KAIO: KAIO is the leading protocol purpose-built for RWAs, ensuring seamless movement, compliance, and liquidity in DeFi.
1Access is through Hamilton Lane SCOPE Private Credit Access fund (""HL SCOPE Access Fund""), a feeder fund setup to invest into SCOPE.
The HL SCOPE Access Fund is not managed or operated by Hamilton Lane.","tokenized, launches, kaio's, institutional-grade, infrastructure, fund, sei, hamilton, lane, private, network, credit, access, kaio, scope, investment, ability, investors, assets, markets, forward-looking, statements, risks, institutional, https, securities, manage, leading, strategies, onchain, hl, digital, information, www, clients",2025-10-15,https://www.morningstar.com/news/pr-newswire/20251015ny97763/hamilton-lane-tokenized-private-credit-fund-launches-on-sei-network-via-kaios-institutional-grade-infrastructure,morningstar,positive,0.9239,2025-10-17 09:30:01
1,private credit,"Capital Southwest: Private Credit Kerfuffle Pushes Yield To 12.7%, I'm Buying Dip (CSWC) - Seeking Alpha","Analyst’s Disclosure:I/we have a beneficial long position in the shares of CSWC, HTGC, MAIN either through stock ownership, options, or other derivatives.
I am not receiving compensation for it (other than from Seeking Alpha).
Any views or opinions expressed above may not reflect those of Seeking Alpha as a whole.
Seeking Alpha is not a licensed securities dealer, broker or US investment adviser or investment bank.
Our analysts are third party authors that include both professional investors and individual investors who may not be licensed or certified by any institute or regulatory body.","capital, southwest, private, credit, kerfuffle, pushes, yield, 12, buying, dip, cswc, seeking, alpha, investment, disclosure, stock, article, opinions, licensed, investors, analyst’s, beneficial, long, position, shares, htgc, main, ownership, options, derivatives, wrote, expresses, receiving, compensation, business",2025-10-15,https://seekingalpha.com/article/4830207-capital-southwest-private-credit-kerfuffle-pushes-yield-to-12-7-percent-im-buying-dip,seeking alpha,positive,0.6083,2025-10-17 09:31:11
3, stock tokenization,Eric Trump Confirms Plans to Tokenize Real Estate With World Liberty Financial - Yahoo Finance,"Eric Trump, son of U.S. President Donald Trump and a co-founder of decentralized finance protocol World Liberty Financial (WLFI), said he is actively working on a real estate tokenization project tied to a building currently under development.
His comments followed Zach Witkoff, another WLFI co-founder, who floated plans to bring the Trump real estate portfolio onchain during a panel discussion at the Token2049 event in Singapore in early October.
Trump suggested in the interview on Wednesday that applying the tokenization model could open investment opportunities to his family’s global base of supporters.
While details remain scarce, he indicated the initiative would be integrated with World Liberty Financial and its U.S. dollar stablecoin USD1.
World Liberty Financial launched last year with a focus on merging crypto infrastructure with traditional financial services.","confirms, tokenize, trump, world, liberty, real, estate, plans, eric, interview, tokenization, building, traditional, model, s, co-founder, protocol, wlfi, working, coindesk, ownership, crypto, rails, global, asset, access, exclusive, retail, investors, hotel, stablecoin, usd1, son, president, donald",2025-10-15,https://finance.yahoo.com/news/eric-trump-confirms-plans-tokenize-192934832.html,yahoo finance,positive,0.7257,2025-10-19 09:34:04
